{
  "person_case_id": "person:REPLACE_WITH_IRREVERSIBLE_ID",
  "birth_input": {"birth_date": "YYYY-MM-DD", "birth_time": "HH:MM", "location_precision": "city", "gender": "REQUIRED", "calendar": "solar", "timezone": "Area/City", "true_solar_time": false, "source": "participant_confirmed", "confirmation_status": "confirmed"},
  "consent": {"consent_status": "granted", "consent_scope": ["research", "benchmark"], "consent_recorded_at": "ISO-8601", "consent_record_ref": "consent:IRREVERSIBLE_REFERENCE", "withdrawal_supported": true, "research_use_allowed": true, "benchmark_use_allowed": true, "publication_use_allowed": false, "raw_data_retention_policy": "controlled_off_git"},
  "case_metadata": {"collection_channel": "authorized_private_intake", "collector_role": "case-coordinator", "created_at": "ISO-8601", "source_provenance": "participant_direct", "conflict_status": "none", "completeness_status": "complete"},
  "scenarios": [{"scenario_id": "scenario:REPLACE", "scenario_type": "career_exam", "target_period": "YYYY", "question_scope": "exam_stage_trend", "known_at_prediction_time": true, "excluded_future_information": []}]
}
